number,value,datetime_start,datetime_complete,duration,params_n_neighbors,params_p,params_weights,system_attrs_tpe:relative_params:0,state
0,0.8080660347749671,2026-09-27 15:47:36.018751,2026-09-27 15:47:36.145501,0 days 00:00:00.126750,3,2,uniform,,COMPLETE
1,0.8271232188814264,2026-09-27 15:47:36.150543,2026-09-27 15:47:36.254888,0 days 00:00:00.104345,9,1,uniform,,COMPLETE
2,0.8271357730211537,2026-09-27 15:47:36.258937,2026-09-27 15:47:36.364849,0 days 00:00:00.105912,13,1,uniform,,COMPLETE
3,0.8338585148452701,2026-09-27 15:47:36.369442,2026-09-27 15:47:36.475896,0 days 00:00:00.106454,8,1,uniform,,COMPLETE
4,0.8013119076015315,2026-09-27 15:47:36.479934,2026-09-27 15:47:36.584163,0 days 00:00:00.104229,9,2,distance,,COMPLETE
5,0.8159060950348378,2026-09-27 15:47:36.587543,2026-09-27 15:47:36.692697,0 days 00:00:00.105154,18,1,distance,,COMPLETE
6,0.822635113928818,2026-09-27 15:47:36.696436,2026-09-27 15:47:36.804561,0 days 00:00:00.108125,8,2,uniform,,COMPLETE
7,0.8271357730211537,2026-09-27 15:47:36.808197,2026-09-27 15:47:36.915939,0 days 00:00:00.107742,13,1,uniform,,COMPLETE
8,0.7844642520871258,2026-09-27 15:47:36.919340,2026-09-27 15:47:37.025226,0 days 00:00:00.105886,4,2,distance,,COMPLETE
9,0.8181532860460736,2026-09-27 15:47:37.028502,2026-09-27 15:47:37.136052,0 days 00:00:00.107550,20,1,distance,,COMPLETE
10,0.820387922917582,2026-09-27 15:47:37.139671,2026-09-27 15:47:37.250867,0 days 00:00:00.111196,19,2,uniform,"{""n_neighbors"": 19, ""p"": 2, ""weights"": ""uniform""}",COMPLETE
11,0.8282468143870441,2026-09-27 15:47:37.254348,2026-09-27 15:47:37.363295,0 days 00:00:00.108947,14,1,uniform,"{""n_neighbors"": 14, ""p"": 1, ""weights"": ""uniform""}",COMPLETE
12,0.8159186491745652,2026-09-27 15:47:37.366785,2026-09-27 15:47:37.476026,0 days 00:00:00.109241,5,1,uniform,"{""n_neighbors"": 5, ""p"": 1, ""weights"": ""uniform""}",COMPLETE
13,0.8214989642834724,2026-09-27 15:47:37.479461,2026-09-27 15:47:37.587248,0 days 00:00:00.107787,14,2,uniform,"{""n_neighbors"": 14, ""p"": 2, ""weights"": ""uniform""}",COMPLETE
14,0.8304877283284163,2026-09-27 15:47:37.590659,2026-09-27 15:47:37.699809,0 days 00:00:00.109150,16,1,uniform,"{""n_neighbors"": 16, ""p"": 1, ""weights"": ""uniform""}",COMPLETE
15,0.8338459607055426,2026-09-27 15:47:37.703696,2026-09-27 15:47:37.812776,0 days 00:00:00.109080,18,1,uniform,"{""n_neighbors"": 18, ""p"": 1, ""weights"": ""uniform""}",COMPLETE
16,0.7934530161320696,2026-09-27 15:47:37.816346,2026-09-27 15:47:37.924697,0 days 00:00:00.108351,6,1,distance,"{""n_neighbors"": 6, ""p"": 1, ""weights"": ""distance""}",COMPLETE
17,0.8271043876718348,2026-09-27 15:47:37.928081,2026-09-27 15:47:38.037468,0 days 00:00:00.109387,20,1,uniform,"{""n_neighbors"": 20, ""p"": 1, ""weights"": ""uniform""}",COMPLETE
18,0.8316113238340342,2026-09-27 15:47:38.040930,2026-09-27 15:47:38.149301,0 days 00:00:00.108371,11,1,uniform,"{""n_neighbors"": 11, ""p"": 1, ""weights"": ""uniform""}",COMPLETE
19,0.8192894356914193,2026-09-27 15:47:38.152736,2026-09-27 15:47:38.261253,0 days 00:00:00.108517,3,1,uniform,"{""n_neighbors"": 3, ""p"": 1, ""weights"": ""uniform""}",COMPLETE
20,0.8080472035653757,2026-09-27 15:47:38.264687,2026-09-27 15:47:38.373295,0 days 00:00:00.108608,12,1,distance,"{""n_neighbors"": 12, ""p"": 1, ""weights"": ""distance""}",COMPLETE
21,0.8215177954930638,2026-09-27 15:47:38.376547,2026-09-27 15:47:38.485793,0 days 00:00:00.109246,7,1,uniform,"{""n_neighbors"": 7, ""p"": 1, ""weights"": ""uniform""}",COMPLETE
22,0.8282405373171804,2026-09-27 15:47:38.489390,2026-09-27 15:47:38.598682,0 days 00:00:00.109292,10,1,uniform,"{""n_neighbors"": 10, ""p"": 1, ""weights"": ""uniform""}",COMPLETE
23,0.82712949595129,2026-09-27 15:47:38.602067,2026-09-27 15:47:38.712597,0 days 00:00:00.110530,17,1,uniform,"{""n_neighbors"": 17, ""p"": 1, ""weights"": ""uniform""}",COMPLETE
24,0.8282405373171804,2026-09-27 15:47:38.716322,2026-09-27 15:47:38.873392,0 days 00:00:00.157070,10,1,uniform,"{""n_neighbors"": 10, ""p"": 1, ""weights"": ""uniform""}",COMPLETE
25,0.8001883120959136,2026-09-27 15:47:38.876611,2026-09-27 15:47:38.983212,0 days 00:00:00.106601,15,2,distance,"{""n_neighbors"": 15, ""p"": 2, ""weights"": ""distance""}",COMPLETE
26,0.8192643274119641,2026-09-27 15:47:38.986672,2026-09-27 15:47:39.095092,0 days 00:00:00.108420,16,2,uniform,"{""n_neighbors"": 16, ""p"": 2, ""weights"": ""uniform""}",COMPLETE
27,0.8215115184232001,2026-09-27 15:47:39.098524,2026-09-27 15:47:39.207993,0 days 00:00:00.109469,10,2,uniform,"{""n_neighbors"": 10, ""p"": 2, ""weights"": ""uniform""}",COMPLETE
28,0.8102943945766118,2026-09-27 15:47:39.212069,2026-09-27 15:47:39.320823,0 days 00:00:00.108754,15,1,distance,"{""n_neighbors"": 15, ""p"": 1, ""weights"": ""distance""}",COMPLETE
29,0.8035465444730401,2026-09-27 15:47:39.324374,2026-09-27 15:47:39.432998,0 days 00:00:00.108624,12,2,distance,"{""n_neighbors"": 12, ""p"": 2, ""weights"": ""distance""}",COMPLETE
30,0.8316113238340342,2026-09-27 15:47:39.436551,2026-09-27 15:47:39.548100,0 days 00:00:00.111549,11,1,uniform,"{""n_neighbors"": 11, ""p"": 1, ""weights"": ""uniform""}",COMPLETE
31,0.8136777352331931,2026-09-27 15:47:39.551527,2026-09-27 15:47:39.660228,0 days 00:00:00.108701,5,2,uniform,"{""n_neighbors"": 5, ""p"": 2, ""weights"": ""uniform""}",COMPLETE
32,0.7990772707300232,2026-09-27 15:47:39.663702,2026-09-27 15:47:39.771324,0 days 00:00:00.107622,8,1,distance,"{""n_neighbors"": 8, ""p"": 1, ""weights"": ""distance""}",COMPLETE
33,0.8316113238340342,2026-09-27 15:47:39.774817,2026-09-27 15:47:39.884225,0 days 00:00:00.109408,11,1,uniform,"{""n_neighbors"": 11, ""p"": 1, ""weights"": ""uniform""}",COMPLETE
34,0.8338585148452701,2026-09-27 15:47:39.887667,2026-09-27 15:47:39.996177,0 days 00:00:00.108510,8,1,uniform,"{""n_neighbors"": 8, ""p"": 1, ""weights"": ""uniform""}",COMPLETE
35,0.8338585148452701,2026-09-27 15:47:39.999717,2026-09-27 15:47:40.108512,0 days 00:00:00.108795,8,1,uniform,"{""n_neighbors"": 8, ""p"": 1, ""weights"": ""uniform""}",COMPLETE
36,0.8338585148452701,2026-09-27 15:47:40.111947,2026-09-27 15:47:40.221436,0 days 00:00:00.109489,8,1,uniform,"{""n_neighbors"": 8, ""p"": 1, ""weights"": ""uniform""}",COMPLETE
37,0.8338585148452701,2026-09-27 15:47:40.225019,2026-09-27 15:47:40.333981,0 days 00:00:00.108962,8,1,uniform,"{""n_neighbors"": 8, ""p"": 1, ""weights"": ""uniform""}",COMPLETE
38,0.8192831586215554,2026-09-27 15:47:40.337422,2026-09-27 15:47:40.446456,0 days 00:00:00.109034,6,1,uniform,"{""n_neighbors"": 6, ""p"": 1, ""weights"": ""uniform""}",COMPLETE
39,0.8271232188814264,2026-09-27 15:47:40.449930,2026-09-27 15:47:40.559801,0 days 00:00:00.109871,9,1,uniform,"{""n_neighbors"": 9, ""p"": 1, ""weights"": ""uniform""}",COMPLETE
